{
  "$schema": "./m3-expressive-v1.25.schema.json",
  "source": "m3ui.fig",
  "version": "M3 Expressive V1.25",
  "scope": "web",
  "excluded": ["XR", "Deprecated/Internal-only canvases"],
  "audit": {
    "componentDirectories": 38,
    "candidateFindings": 420,
    "confirmedFindings": 325,
    "mixedEvidenceFindings": 48,
    "refutedFindings": 47,
    "compatibility": "Preserve documented non-kit extensions; correct kit-backed variants and defaults"
  },
  "tolerance": {
    "geometryPx": 0.5,
    "opacity": 0.005,
    "borderRadiusPx": 0,
    "elevationLevel": 0,
    "resolvedRoleColor": 0
  },
  "stateOpacity": {
    "hover": 0.08,
    "focus": 0.1,
    "pressRipple": 0.1,
    "disabledContainer": 0.1,
    "dragged": 0.16,
    "disabledContent": 0.38,
    "checkboxFocusAndPress": 0.12,
    "textFieldDisabledOutline": 0.12,
    "fabMenuScrim": 0.32
  },
  "geometry": {
    "avatar": { "width": 40, "height": 40, "radius": "50%" },
    "badge.large": { "width": 16, "height": 16, "boxSizing": "border-box" },
    "button.visibleHeights": [32, 40, 56, 96, 136],
    "button.compactHitTarget": 48,
    "iconButton.icons": { "large": 32, "extraLarge": 40 },
    "iconButton.smallWide": { "width": 52, "height": 40 },
    "buttonGroup.iconSegmentWidths": [40, 52, 72, 128, 184],
    "splitButton.compactHitTarget": 48,
    "fab.kitSizes": { "small": 56, "medium": 80, "large": 96 },
    "checkbox": { "mark": 18, "outline": 2, "stateLayer": 40, "target": 48 },
    "radioButton": { "ring": 20, "outline": 2, "stateLayer": 40, "target": 48 },
    "switch": { "trackWidth": 52, "trackHeight": 32, "trackOutline": 2, "stateLayer": 40, "pressedThumb": 28 },
    "chip": { "height": 32, "avatar": 24, "avatarLeadingInset": 4 },
    "menu": { "row": 48, "paintedSurface": 44 },
    "tabs.primaryIconLabel": { "height": 64, "indicatorHeight": 3 },
    "tabs.primaryIconOnly": { "height": 48 },
    "tabs.secondary": { "height": 48, "indicatorHeight": 2, "iconLabelGap": 8 },
    "tabs.inlinePadding": 16,
    "tabs.badgeGap": 4,
    "navigationBar": { "verticalHeight": 64, "horizontalInlinePadding": 16, "itemGap": 20 },
    "navigationRail": {
      "collapsedWidth": 96,
      "collapsedItemHeight": 64,
      "expandedLabelGap": 14,
      "expandedItemGap": 20,
      "menuButton": 56
    },
    "toolbar": { "crossAxis": 64, "floatingRadius": 32 },
    "tooltip.multiline": { "width": 200, "boxSizing": "border-box" },
    "appBar": {
      "smallHeight": 64,
      "mediumHeight": 112,
      "largeHeight": 120,
      "actionSlot": 48,
      "titleGap": 4,
      "searchHeight": 56,
      "searchRadius": 28
    },
    "bottomSheet": { "visibleHandleBand": 36, "handleTarget": 48 },
    "sideSheet": { "width": 320, "modalRadius": 16 },
    "dialog": { "maxWidth": 560, "viewportInset": 24 },
    "divider.thickness": 1,
    "carousel": {
      "smallWidth": 56,
      "mediumWidth": 120,
      "defaultHeight": 204,
      "uncontainedMin": 154,
      "uncontainedPreferredCqi": 40,
      "uncontainedMax": 163
    },
    "search.resultRadii": { "baseline": 4, "expressive": 12 },
    "snackbar": { "width": 344, "compactViewportInset": 16, "controlSurface": 40, "controlTarget": 48 },
    "list": {
      "oneLineHeight": 56,
      "childTarget": 48,
      "inlineInset": 16,
      "segmentedRestRadius": 4,
      "segmentedStateRadius": 16,
      "checkboxMark": 18,
      "radioMark": 20,
      "threeLineBlockPadding": 12
    },
    "list.density": { "0": [56, 72, 88], "-2": [48, 64, 80], "-4": [40, 56, 72] },
    "slider": {
      "touchWrapperWidth": 68,
      "touchWrapperHeight": 48,
      "handleGap": 6,
      "endInset": 6,
      "stopInset": 6,
      "innerTrackRadius": 2,
      "tooltipInlinePadding": 16
    },
    "textField": {
      "restingStroke": 1,
      "focusStroke": 3,
      "errorRestingStroke": 1,
      "errorFocusStroke": 3,
      "iconGap": 16
    },
    "datePicker": { "cellPitch": 48, "panelWidth": 360, "selectorPill": 40, "navigationIcon": 24 },
    "timePicker": {
      "radius": 28,
      "landscapeWidth": 572,
      "landscapeHeight": 384,
      "dialTypeSize": 57,
      "dialTypeLineHeight": 64,
      "inputTypeSize": 45,
      "inputTypeLineHeight": 52
    },
    "progress.thickness": [4, 8],
    "linearProgress": { "amplitudes": [3, 3], "wavelengths": [20, 40], "gap": 4 },
    "circularProgress": { "arcGap": 4, "waveCycles": 9 },
    "loadingIndicator": { "root": 48, "shapeFrame": 38 }
  },
  "roles": {
    "surfaceTint": "primary",
    "button.outlined.border": "outline-variant",
    "iconButton.standard.selected.foreground": "primary",
    "iconButton.outlined.foreground": "on-surface-variant",
    "iconButton.outlined.selected.container": "inverse-surface",
    "iconButton.outlined.selected.foreground": "inverse-on-surface",
    "toolbar.standard.selected.container": "secondary-container",
    "toolbar.vibrant.container": "primary-container",
    "toolbar.vibrant.foreground": "on-primary-container",
    "toolbar.vibrant.selected.container": "surface-container",
    "toolbar.vibrant.selected.foreground": "on-surface",
    "checkbox.unselected.outline": "on-surface-variant",
    "radioButton.unselected.outline": "on-surface-variant",
    "chip.outlined.border": "outline-variant",
    "menu.container": "surface-container",
    "tabs.defaultContainer": "surface",
    "navigationBar.container": "surface-container",
    "navigationRail.collapsed.activeLabel": "secondary",
    "bottomSheet.handle": "outline",
    "sideSheet.title": "on-surface-variant",
    "list.dragged.container": "tertiary-container",
    "list.dragged.foreground": "on-tertiary-container",
    "progress.track": "secondary-container",
    "loadingIndicator.container": "primary-container",
    "loadingIndicator.indicator": "on-primary-container"
  },
  "elevation": {
    "button.elevatedBySize": [1, 1, 2, 3, 3],
    "fab.rest": 3,
    "fab.hover": 4,
    "fabMenu.scrim": 0,
    "menu": 2,
    "toolbar.floating": 3,
    "bottomSheet.standard": 3,
    "bottomSheet.modal": 0,
    "dialog": 3,
    "card.rest": 2,
    "card.hover": 2,
    "card.pressed": 1,
    "card.dragged": 1,
    "snackbar": 3,
    "list.dragged": 5
  },
  "typography": {
    "canonicalTypeface": "Roboto Flex",
    "emphasized500": [
      "display-large",
      "display-medium",
      "display-small",
      "headline-large",
      "headline-medium",
      "headline-small",
      "title-large"
    ],
    "extension": { "display-xlarge": true },
    "componentTracking": {
      "badge": 0.1,
      "navigationBar.label": 0.1,
      "navigationRail.collapsedLabel": 0.1
    },
    "appBar.supportingWeight": 500,
    "appBar.largeSupporting": { "size": 16, "lineHeight": 24 },
    "list.overline": "label-medium"
  },
  "motion": {
    "shapeMorph": { "duration": "spring-default-effects", "easing": "spring-default-effects" },
    "loadingIndicator": "spring-default-spatial",
    "inventedStaticFigmaMotionAllowed": false
  },
  "apiDefaults": {
    "avatar.size": 40,
    "chipGroup.layout": "scroll",
    "slider.mode": "standard",
    "slider.showTooltip": false,
    "list.density": 0,
    "searchView.appearance": "baseline",
    "progress.thickness": 4,
    "loadingIndicator.size": 48,
    "toggleButton.morph": true,
    "toggleIconButton.morph": true,
    "splitButton.morph": true
  },
  "componentCoverage": [
    "AppBar",
    "Avatar",
    "Badge",
    "BottomSheet",
    "Button",
    "ButtonGroup",
    "Card",
    "Carousel",
    "Checkbox",
    "Chip",
    "ChipGroup",
    "CircularProgress",
    "DatePicker",
    "Dialog",
    "Divider",
    "ExtendableFab",
    "ExtendedFab",
    "Fab",
    "FabMenu",
    "IconButton",
    "LinearProgress",
    "List",
    "LoadingIndicator",
    "Menu",
    "NavigationBar",
    "NavigationRail",
    "OTPInput",
    "RadioButton",
    "Search",
    "SideSheet",
    "Skeleton",
    "Slider",
    "Snackbar",
    "SplitButton",
    "Switch",
    "Tabs",
    "TextField",
    "TimePicker",
    "ToggleButton",
    "ToggleIconButton",
    "Toolbar",
    "Tooltip"
  ],
  "documentedExtensions": [
    "Elevated IconButton and ToggleIconButton",
    "RichTooltip",
    "Heavy and inset Divider",
    "Extra FAB sizes and variants",
    "Elevated Input Chip",
    "Bare Card composition",
    "LoadingIndicator size extensions",
    "Skeleton loading placeholder",
    "OTPInput one-time code field",
    "Display XLarge",
    "Menu container, row geometry and elevation from material.you (surface-container, level 2) instead of the kit (surface-container-low, level 3)",
    "Corner morphs on the effects spring instead of the kit token's fast-spatial spring"
  ],
  "intentionalNonComponents": [
    "Segmented Button kit page",
    "Shape sheets",
    "Keyboard",
    "Layout grids",
    "Decorative kit pages",
    "XR"
  ]
}
